{
  "record_type": "production_identity",
  "schema_version": "er_commons.document_publication_identity.v2",
  "fixture_status": "identity_recipe",
  "execution_status": "not_executed",
  "extraction_id": "exv1-6913f56bed93302d7cf5ef424ee63c0b7427e90e2b2cd5c4ec483d275009a773",
  "identity_sha256": "6913f56bed93302d7cf5ef424ee63c0b7427e90e2b2cd5c4ec483d275009a773",
  "preimage": {
    "schema_version": "er_commons.document_publication_identity_preimage.v2",
    "contract_revision": "task_03h_production_full_v1",
    "extraction_version_name": "brisbane_baylands_2025_deir_task03h_candidate_v1",
    "production_scope": {
      "source_release_version": "brisbane_baylands_2025_deir_sources_v1",
      "source_manifest": {
        "path": "datasets/ceqa/raw/brisbane_baylands/brisbane_baylands_2025_deir_sources_v1/records/source_manifest.json",
        "sha256": "fede3e4af815378b77a7f7f54c863ef095328da789859d4f4b25a524f3408f38",
        "byte_size": 2649317
      },
      "release_completion": {
        "path": "datasets/ceqa/raw/brisbane_baylands/brisbane_baylands_2025_deir_sources_v1/records/completion_record.json",
        "sha256": "d1175d6bf54d2c557293cb7bb0e1191250a9b5db2aef5c9e563ebe01e58767a6",
        "byte_size": 1336
      },
      "ordered_source_ids": [
        "deir_appendix_k4",
        "deir_appendix_n1",
        "deir_appendix_k5",
        "deir_appendix_n2",
        "deir_appendix_f2",
        "deir_appendix_k6",
        "deir_appendix_m3",
        "deir_appendix_l",
        "deir_appendix_o",
        "deir_appendix_f1",
        "deir_appendix_c",
        "deir_appendix_j",
        "deir_appendix_p",
        "deir_appendix_m1",
        "deir_appendix_b",
        "deir_appendix_d",
        "deir_appendix_e",
        "deir_appendix_a",
        "deir_appendix_k1_part_1_of_4",
        "deir_appendix_m2",
        "deir_appendix_k2_part_2_of_5",
        "deir_appendix_k3",
        "deir_appendix_k1_part_2_of_4",
        "deir_appendix_k2_part_1_of_5",
        "deir_main",
        "deir_appendix_k2_part_5_of_5",
        "deir_appendix_i",
        "deir_appendix_g1",
        "deir_appendix_k1_part_4_of_4",
        "deir_appendix_h",
        "deir_appendix_k1_part_3_of_4",
        "deir_appendix_g2",
        "deir_appendix_k2_part_4_of_5",
        "deir_appendix_g3",
        "deir_appendix_k2_part_3_of_5"
      ],
      "ordered_source_records_sha256": "a7f99c4d13cf8b557fc3b250e2a1ecdbc05012570ac0d96f6afcab64a6bc8c99",
      "allowed_scope_kinds": [
        "production_full"
      ]
    },
    "document_process_contract": {
      "version": "task03h-six-process-fresh-document-v1",
      "artifacts": [
        {
          "path": "benchmarks/er_bench/schemas/canonical_extraction/v2/semantic_structure.schema.json",
          "sha256": "6d9fd6bbca2f6a4c16480de2f82883b16a60794972980845fff8b9eb4af3e758",
          "byte_size": 18624
        },
        {
          "path": "benchmarks/er_bench/schemas/canonical_extraction/v3/cross_references.schema.json",
          "sha256": "cd18ed726e1409d20d14528dd26cae4804a3ce7145b4c53e80512e271380de4c",
          "byte_size": 28234
        },
        {
          "path": "benchmarks/er_bench/schemas/document_publication/v2/document_run_spec.schema.json",
          "sha256": "ac11477557ae1b590a6c6119932b0d0dd3d38b05b32e265f0153e9111847bd69",
          "byte_size": 6275
        },
        {
          "path": "benchmarks/er_bench/schemas/document_publication/v2/production_identity.schema.json",
          "sha256": "f40726cded6d9bc3f3cc14f812f0c46fae6c506f3a1219d77841394b253bea10",
          "byte_size": 2841
        },
        {
          "path": "benchmarks/er_bench/schemas/hierarchy_correction/v1/records.schema.json",
          "sha256": "00f9cc019752e22cec4a728d8229e8bf98837e0ba551e2d88ca8843ad655c049",
          "byte_size": 20431
        },
        {
          "path": "configs/task03h/v4/deir_appendix_a/chunked_conversion.json",
          "sha256": "16d1b42bba2bb26b087b8a990d78920c81710fe28f6fa92d3d859a900dfb56bc",
          "byte_size": 395
        },
        {
          "path": "configs/task03h/v4/deir_appendix_a/content_parsing.json",
          "sha256": "1761d7b40701e1bde6374fd5a323e88cbfc06dec815c06c5c27593f7867b3fe7",
          "byte_size": 3006
        },
        {
          "path": "configs/task03h/v4/deir_appendix_a/document_reference_linking.json",
          "sha256": "a6f8d0ae314ba2a6ff7037cbf15a38a631ab377e39dd97629ae682bcd57a9855",
          "byte_size": 1201
        },
        {
          "path": "configs/task03h/v4/deir_appendix_a/document_structure.json",
          "sha256": "62c45cd3f3be2db5f1e98665a8bc341ff69a03284fb3d7ca348dd01fe7b877ab",
          "byte_size": 2114
        },
        {
          "path": "configs/task03h/v4/deir_appendix_a/heading_evidence_parsing.json",
          "sha256": "d94a22eb5a835ea703f4d86f03d54c01da129371e2d8f426332731765a59f303",
          "byte_size": 3092
        },
        {
          "path": "configs/task03h/v4/deir_appendix_a/hierarchy_inference.json",
          "sha256": "8a4de45128d7e92da4e851d7ad629ab06360e90ae7add393915ea9ed31027667",
          "byte_size": 1284
        },
        {
          "path": "configs/task03h/v4/deir_appendix_a/record_mapping.json",
          "sha256": "656290d5b5212890d7544842cbfa093f412ecc310aac485ff6ba5d3e65ed7654",
          "byte_size": 1058
        },
        {
          "path": "configs/task03h/v4/deir_appendix_b/content_parsing.json",
          "sha256": "0edd7b95cd44f5c3892d52b1569e2ee453351d931c488142ab37d6b7c2d1096a",
          "byte_size": 3020
        },
        {
          "path": "configs/task03h/v4/deir_appendix_b/document_reference_linking.json",
          "sha256": "d945217ae0a2c424c4b631364bc653e210cf50492fb13dc93e02b7f286397865",
          "byte_size": 1201
        },
        {
          "path": "configs/task03h/v4/deir_appendix_b/document_structure.json",
          "sha256": "1f01fceb3a76c869ec334749ca8fb6f9fad5338e3ac7398168b0723fba52ad95",
          "byte_size": 2114
        },
        {
          "path": "configs/task03h/v4/deir_appendix_b/heading_evidence_parsing.json",
          "sha256": "b140a1ecc708a0f3742946c9e4705974110a0a5c6cab977e2295d3ccda98b942",
          "byte_size": 3106
        },
        {
          "path": "configs/task03h/v4/deir_appendix_b/hierarchy_inference.json",
          "sha256": "cfa3d00f4f66ba977c587838ff64197131b0aa49a0f750c76161c12ba655d7bc",
          "byte_size": 1298
        },
        {
          "path": "configs/task03h/v4/deir_appendix_b/record_mapping.json",
          "sha256": "13314e9352b0fbafd5af56b417e788310a1de8e009c2afce5dd46830aa23d670",
          "byte_size": 1058
        },
        {
          "path": "configs/task03h/v4/deir_appendix_c/content_parsing.json",
          "sha256": "6fd91ad8a784cdfa0c4aa2a4a0f7d727045bd7af5b0f04f6ee7e34032296afc0",
          "byte_size": 3004
        },
        {
          "path": "configs/task03h/v4/deir_appendix_c/document_reference_linking.json",
          "sha256": "61d8c327073f271a28e4da7491d45ddfe89c862f43ce73e23b4638ba18187dba",
          "byte_size": 1201
        },
        {
          "path": "configs/task03h/v4/deir_appendix_c/document_structure.json",
          "sha256": "21bc75f41823eb030fd7595c17bd11709e30f1595f93cec6b5935813165d851a",
          "byte_size": 2113
        },
        {
          "path": "configs/task03h/v4/deir_appendix_c/heading_evidence_parsing.json",
          "sha256": "2ddae45bd630f1df756540464e37c173f5367b96b13f1e8cdb4b4a8d28d244dc",
          "byte_size": 3090
        },
        {
          "path": "configs/task03h/v4/deir_appendix_c/hierarchy_inference.json",
          "sha256": "e52733ae3b13a40d5d2cc210a6f926eabc0a8c65072db165cd49ef448e17bcf3",
          "byte_size": 1282
        },
        {
          "path": "configs/task03h/v4/deir_appendix_c/record_mapping.json",
          "sha256": "efd18a786cea03384cd9c9521beb8591c106489e00468fd0f05a4bbd1ddf3649",
          "byte_size": 1057
        },
        {
          "path": "configs/task03h/v4/deir_appendix_d/chunked_conversion.json",
          "sha256": "16d1b42bba2bb26b087b8a990d78920c81710fe28f6fa92d3d859a900dfb56bc",
          "byte_size": 395
        },
        {
          "path": "configs/task03h/v4/deir_appendix_d/content_parsing.json",
          "sha256": "0ad4dcc4ac60940cee5e066ba2f5819df74f865d5cf7e4383640cd172f561280",
          "byte_size": 3015
        },
        {
          "path": "configs/task03h/v4/deir_appendix_d/document_reference_linking.json",
          "sha256": "5875a951333ca8a888b7f7b52f61b4126bd06e722d0233e7b35c66fd9dcd3d61",
          "byte_size": 1201
        },
        {
          "path": "configs/task03h/v4/deir_appendix_d/document_structure.json",
          "sha256": "c79d732830cbf142639402793a8ef57bf80dfd6af8e06a83d0d48d62efa7ab37",
          "byte_size": 2114
        },
        {
          "path": "configs/task03h/v4/deir_appendix_d/heading_evidence_parsing.json",
          "sha256": "2355f767c95a7f0d8ab09d2adfac78876c001d75daf7e0efa1d8b48b847d1142",
          "byte_size": 3101
        },
        {
          "path": "configs/task03h/v4/deir_appendix_d/hierarchy_inference.json",
          "sha256": "c348c3e4f7d571304cf4e0b4c8928f677cd7d3e200c07d3b910a1137692e5691",
          "byte_size": 1293
        },
        {
          "path": "configs/task03h/v4/deir_appendix_d/record_mapping.json",
          "sha256": "b2d4b07fc791233153a0140967bf6797ea50cb790b8a74d50f0fa7110c42e85c",
          "byte_size": 1058
        },
        {
          "path": "configs/task03h/v4/deir_appendix_e/chunked_conversion.json",
          "sha256": "16d1b42bba2bb26b087b8a990d78920c81710fe28f6fa92d3d859a900dfb56bc",
          "byte_size": 395
        },
        {
          "path": "configs/task03h/v4/deir_appendix_e/content_parsing.json",
          "sha256": "4222f15c7bd92d9b8429f2aff56172964b723288f40a144a68be91ba55e130e2",
          "byte_size": 3013
        },
        {